{
  "receipt_id": "example-2026-07-17-core-sync",
  "type": "sync",
  "date": "2026-07-17",
  "profile": "core",
  "target_project": "example-project",
  "source_commit": "0000000000000000000000000000000000000000",
  "files_changed": [],
  "validated": true,
  "validator": "scripts/validate.py",
  "notes": "Worked example only, not a real sync. Delete or replace once a real profile delivery happens."
}
